ObjectType,ObjectName,Description,Utilization,ParametersJson,OutputNotes,ReferencedObjectsJson,IRI,CodeColumn,Code,AccessBitmap
Column,DimEvents.SourceID,"Database Column named DimEvents.SourceID. SourceID enables us to create events in a ""namespace"". This is so if different DWs or other sources have the same event with different meanings.",NULL,NULL,NULL,NULL,NULL,NULL,NULL,-1
Column,EventsFact.AccessBitmap,"Database Column named EventsFact.AccessBitmap. At import, the event should inherit from a sum of Case and DimEvent AccessBitmap. This ensures we're secured at the lowest granularity.",NULL,NULL,NULL,NULL,NULL,NULL,NULL,-1
Column,EventsFact.AggregationTypeID,"Database Column named EventsFact.AggregationTypeID. The event might be an aggregation of smaller events compressed through a Streaming analytics port. If it is, information of the aggregation should be in the EventProperties.AggregationProperties field as a JSON.",NULL,NULL,NULL,NULL,NULL,NULL,NULL,-1
Column,EventsFact.BatchID,"Database Column named EventsFact.BatchID. An ID that could be used to delete events, eventproperties, case, case properties. See Delete_Batch sproc.",NULL,NULL,NULL,NULL,NULL,NULL,NULL,-1
Column,EventsFact.CaseID,Database Column named EventsFact.CaseID. Even a long-running case should have an ID. That would be like a feed from an IoT device that goes on indefinitely.,NULL,NULL,NULL,NULL,NULL,NULL,NULL,-1
Column,CaseProperties.TargetProperties,Database Column named CaseProperties.TargetProperties. Properties related to what we targeted for the case.,NULL,NULL,NULL,NULL,NULL,NULL,NULL,-1
Column,EventsFact.CaseOrdinal,Database Column named EventsFact.CaseOrdinal. Order of the event within the case.,,,,,,,,
,,,,,,,,,,
"The order is already defined by EventDate, but without ordinal, it's hard to easily fetch the n-x or n+x, first row. ",,,,,,,,,,
,,,,,,,,,,
This should be calculated for each case in the ETL using RANK.,NULL,NULL,NULL,NULL,NULL,NULL,NULL,-1,,
Column,EventsFact.Event,"Database Column named EventsFact.Event. There should always be an event, but it doesn't need to be in the events table. It's a case of allow an event that's not in the events table and deal with it later.",NULL,NULL,NULL,NULL,NULL,NULL,NULL,-1
Column,EventsFact.ParentCaseID,Database Column named EventsFact.ParentCaseID. This is used to connect sub-processes to a parent case.,NULL,NULL,NULL,NULL,NULL,NULL,NULL,-1
Column,AggregationTypes.IsNative,"Database Column named AggregationTypes.IsNative. 0=Aggregation is custom,  some ETL package.",NULL,NULL,NULL,NULL,NULL,NULL,NULL,-1
Column,AggregationTypes.Metadata,"Database Column named AggregationTypes.Metadata. This is a json of metadata regarding the aggregation. It can include things such as the ETL package, function, or program that created it, and required parameters.",NULL,NULL,NULL,NULL,NULL,NULL,NULL,-1
Column,DimObservers.Code,Database Column named DimObservers.Code. Code of the observer (generator of events).,NULL,NULL,NULL,NULL,NULL,NULL,NULL,-1
Column,DimObservers.Parent_ObserverID,"Database Column named DimObservers.Parent_ObserverID. Observers are the devices (IoT, AI agents, cars, phones), and each can consist of a hierarchy of event emitters.",,,,,,,,
,,,,,,,,,,
Note that Observers differ from Sources in that a Source is where case and event properties can be looked up.,NULL,NULL,NULL,NULL,NULL,NULL,NULL,-1,,
Column,DimObservers.SourceID,Database Column named DimObservers.SourceID. The storage place of event generated by the observer. This is where the Events Ensemble reads the events. ,NULL,NULL,NULL,NULL,NULL,NULL,NULL,-1
Column,ImportEvents.AccessBitmap,Database Column named ImportEvents.AccessBitmap. Default of -1 means all bits are set.,NULL,NULL,NULL,NULL,NULL,NULL,NULL,-1
Column,ImportEvents.CaseID,"Database Column named ImportEvents.CaseID. Really, the naturalkey of the case. it will be imported as Case.NaturalKey.",NULL,NULL,NULL,NULL,NULL,NULL,NULL,-1
Column,ImportEvents.CaseProperties,"Database Column named ImportEvents.CaseProperties. This is a flattened table, so all CaseProperties for a CaseID should be the same.",NULL,NULL,NULL,NULL,NULL,NULL,NULL,-1
Column,ImportEvents.CaseTargetProperties,"Database Column named ImportEvents.CaseTargetProperties. This is a flattened table, so all CaseTargetProperties for a CaseID should be the same.",NULL,NULL,NULL,NULL,NULL,NULL,NULL,-1
Column,ImportEvents.CaseType,"Database Column named ImportEvents.CaseType. Should be the same as CaseTypes.[Name], which is the ""code"" for case types.",NULL,NULL,NULL,NULL,NULL,NULL,NULL,-1
Column,ImportEvents.SourceID,Database Column named ImportEvents.SourceID. Could be JSON of parts comprising the natural key.,NULL,NULL,NULL,NULL,NULL,NULL,NULL,-1
Column,Models.ModelType,Database Column named Models.ModelType. 1. BayesianProbability - Conditional probability,,,,,,,,
,,,,,,,,,,
2. MarkovChain - Created from event sets and event facts.,,,,,,,,,,
,,,,,,,,,,
"3. Workflow - This is an intended process. It may not even have events. Workflows could be made concrete from Markov Models. Workflows could also be decision trees, strategy maps.",NULL,NULL,NULL,NULL,NULL,NULL,NULL,-1,,
Column,Models.Order,"Database Column named Models.Order. A ""proper"" Markov model is first order (1), which means the next event depends on only the current event. That's the default. We can also specify 2nd and 3rd order models, meaning the next event depends on the n-1 and n event (2nd order), or n-2, n-1, and n event for 3rd order.",NULL,NULL,NULL,NULL,NULL,NULL,NULL,-1
Column,Models.ParamHash,Database Column named Models.ParamHash. This is a hash of the model-level parameters. This mostly helps to link Model events that are bayesian probabilities with markov models. This helps enable hidden markov model so we can link an event from a markov model to an event from a bayesian pair (specifically Event A).,NULL,NULL,NULL,NULL,NULL,NULL,NULL,-1
Column,Models.transformskey,Database Column named Models.transformskey. The hash key to the transforms table. it is a set of key-value pairs converting an event to another.,NULL,NULL,NULL,NULL,NULL,NULL,NULL,-1
Column,ModelEvents.CoefVar,"Database Column named ModelEvents.CoefVar. Coefficient of Variance - Statistical measure that represents the ratio of the standard deviation to the mean of a dataset, expressed as a percentage.",NULL,NULL,NULL,NULL,NULL,NULL,NULL,-1
Column,ModelEvents.IsEntry,Database Column named ModelEvents.IsEntry. How many times was this the entry point?,NULL,NULL,NULL,NULL,NULL,NULL,NULL,-1
Column,ModelEvents.IsExit,Database Column named ModelEvents.IsExit. How many times was this the exit?,NULL,NULL,NULL,NULL,NULL,NULL,NULL,-1
Column,ModelEvents.ModelID,Database Column named ModelEvents.ModelID. 1st Order Markov Models.,NULL,NULL,NULL,NULL,NULL,NULL,NULL,-1
Column,ModelEvents.Prob,Database Column named ModelEvents.Prob. Probability of EventA to EventB. It is the number of times EventA transitions to EventB versus the total number of transitions of EventA to any other Event.,NULL,NULL,NULL,NULL,NULL,NULL,NULL,-1
Column,ModelEvents.Skew,Database Column named ModelEvents.Skew. Many distibutions between events will be skewed. I think skewed left would be more common since i think things could take longer but can only be so fast (like zero seconds).,,,,,,,,
,,,,,,,,,,
It actually requires yet another pass AFTER getting StDev (it needs StDev).,NULL,NULL,NULL,NULL,NULL,NULL,NULL,-1,,
Column,SourceColumns.AccessBitmap,"Database Column named SourceColumns.AccessBitmap. Source columns are related to Event-level and case-level properties, which might be sensitive.",NULL,NULL,NULL,NULL,NULL,NULL,NULL,-1
Column,SourceColumns.ColumnName,"Database Column named SourceColumns.ColumnName. ColumnName should be 50 because that's the length I have for the ""Name"" of the table rows. See the get_semantic_web_llm_values sproc.",NULL,NULL,NULL,NULL,NULL,NULL,NULL,-1
Column,SourceColumns.DataType,Database Column named SourceColumns.DataType. Leave this column NULL since we may not know the data type initially. Try to use SQL Server data types since this is a SQL Server database.,NULL,NULL,NULL,NULL,NULL,NULL,NULL,-1
Column,SourceColumns.Description,Database Column named SourceColumns.Description. Description of what the column is semantically about. This can be used to figure out an IRI RDF class that matches the meaning of this column.,NULL,NULL,NULL,NULL,NULL,NULL,NULL,-1
Column,SourceColumns.IRI,Database Column named SourceColumns.IRI. The IRI (Internation Resource Identifier) is the gateway to a knowledge graph.,NULL,NULL,NULL,NULL,NULL,NULL,NULL,-1
Column,SourceColumns.IsOrdinal,"Database Column named SourceColumns.IsOrdinal. Is this column ordinal (1) or discrete (0)? The column can be used to correlate changes in Markov models across values of this column. If the column is continuous, it's considered ordinal.",NULL,NULL,NULL,NULL,NULL,NULL,NULL,-1
Column,SourceColumns.ObserverID,"Database Column named SourceColumns.ObserverID. A data source stores data observed by an observer. however, a data source might consist of multiple observers-like a person has multiple senses or a car has multiple devices emitting events.",,,,,,,,
,,,,,,,,,,
AI agents could be an observer.,NULL,NULL,NULL,NULL,NULL,NULL,NULL,-1,,
Column,Sources.DefaultObserverID,"Database Column named Sources.DefaultObserverID. A data source stores data observed by an observer. however, a data source might consist of multiple observers-like a person has multiple senses or a car has multiple devices emitting events.",,,,,,,,
,,,,,,,,,,
This is the default observer.,NULL,NULL,NULL,NULL,NULL,NULL,NULL,-1,,
Column,Sources.DefaultTableName,"Database Column named Sources.DefaultTableName. It's possible the source is ""one big table"" or a CSV. In this case, it helps to have the name of the table as a default.",NULL,NULL,NULL,NULL,NULL,NULL,NULL,-1
Column,Sources.PropertiesJSONFullyQualifiedColumnName,"Database Column named Sources.PropertiesJSONFullyQualifiedColumnName. Name of source fully qualified column name (schema,table.column) containing JSON of case-level properties.",NULL,NULL,NULL,NULL,NULL,NULL,NULL,-1
Column,Sources.TargetJSONFullyQualifiedColumnName,"Database Column named Sources.TargetJSONFullyQualifiedColumnName. Name of source fully qualified column name (schema,table.column) containing JSON of case-level properties.",NULL,NULL,NULL,NULL,NULL,NULL,NULL,-1
Column,CasePropertiesMDM.MDMComparisonTypeID,Database Column named CasePropertiesMDM.MDMComparisonTypeID. See MDMComparisonType table.,NULL,NULL,NULL,NULL,NULL,NULL,NULL,-1
Column,CasePropertiesMDM.MDMVersionID,"Database Column named CasePropertiesMDM.MDMVersionID. There can be many ""MDM"" mappings. This MDMVersionID allows for multiple mappings. The -1 default is the default mapping that will be transformed at the time CasePropertiesParsed is created.",NULL,NULL,NULL,NULL,NULL,NULL,NULL,-1
Column,ModelSimilarity.PercentSameSegments,Database Column named ModelSimilarity.PercentSameSegments. Percentage of EventA->EventB segments that are shared.,NULL,NULL,NULL,NULL,NULL,NULL,NULL,-1
Column,EventProperties.ActualProperties,Database Column named EventProperties.ActualProperties. Metric inputs - key/value pairs of metrics as inputs into a node.,,,,,,,,
,,,,,,,,,,
The idea behind InputProperties and OutputProperties is that something happens between entering the state and exiting. Things can also happen between exiting a state and entering another one.,,,,,,,,,,
,,,,,,,,,,
"See the table Metrics and the scalar function, MetricValue.",NULL,NULL,NULL,NULL,NULL,NULL,NULL,-1,,
Column,EventProperties.AggregationProperties,"Database Column named EventProperties.AggregationProperties. If an Event is an aggregation, these are the properties of the aggregation. Examples of keys would be the aggregator's name, each descriptive statistic of the aggregation.",,,,,,,,
,,,,,,,,,,
See the AggregationTypes table.,NULL,NULL,NULL,NULL,NULL,NULL,NULL,-1,,
Column,EventProperties.EventID,Database Column named EventProperties.EventID. JSON bag of properties.,NULL,NULL,NULL,NULL,NULL,NULL,NULL,-1
Column,EventProperties.ExpectedProperties,Database Column named EventProperties.ExpectedProperties. Metric inputs - key/value pairs of metrics as Outputs from a node.,,,,,,,,
,,,,,,,,,,
See description for InputProperties.,,,,,,,,,,
,,,,,,,,,,
"If the event just a reading, there shouldn't be OutputProperties.",NULL,NULL,NULL,NULL,NULL,NULL,NULL,-1,,
Column,EventProperties.IntendedProperties,Database Column named EventProperties.IntendedProperties. Actual vs. Expected (predicted) is the subject of statisticians creating the confusion matrix. Intended is what we're shooting for.,NULL,NULL,NULL,NULL,NULL,NULL,NULL,-1
Column,EventProperties.TriggerFunction,"Database Column named EventProperties.TriggerFunction. The function, a prolog, a rest call, etc. that triggered the function. The parameters could be in the ActualProperties.",,,,,,,,
,,,,,,,,,,
The importance of knowing why the event trigged added reasoning and something that can help us adjust how the events are triggered.,NULL,NULL,NULL,NULL,NULL,NULL,NULL,-1,,
Column,BayesianProbabilities.A_Int_BCount,Database Column named BayesianProbabilities.A_Int_BCount. Allow a null in case we don't have this value.,NULL,NULL,NULL,NULL,NULL,NULL,NULL,-1
Column,BayesianProbabilities.ACount,Database Column named BayesianProbabilities.ACount. Allow a null in case we don't have this value.,NULL,NULL,NULL,NULL,NULL,NULL,NULL,-1
Column,BayesianProbabilities.BCount,Database Column named BayesianProbabilities.BCount. Allow a null in case we don't have this value.,NULL,NULL,NULL,NULL,NULL,NULL,NULL,-1
Column,BayesianProbabilities.GroupType,"Database Column named BayesianProbabilities.GroupType. We can group events as cases, days, months, year.",NULL,NULL,NULL,NULL,NULL,NULL,NULL,-1
Column,CasePropertiesParsed.AddedProperty,"Database Column named CasePropertiesParsed.AddedProperty. 0=This was parsed out of CaseProperties, 1=Added outside of case properties. CaseProperties is silver-level, cleansed table, not added.",NULL,NULL,NULL,NULL,NULL,NULL,NULL,-1
Column,CasePropertiesParsed.CaseID,Database Column named CasePropertiesParsed.CaseID. JSON bag of properties.,NULL,NULL,NULL,NULL,NULL,NULL,NULL,-1
Column,CasePropertiesParsed.PropertyName,"Database Column named CasePropertiesParsed.PropertyName. Case-level properties. This is anything related to the property. For example, the customer id, the employee id of the person who served the customer. These could be used to slice and dice the cases.",,,,,,,,
,,,,,,,,,,
This is a JSON field. This is to allow for a heterogeneous mix of case and event types.,,,,,,,,,,
,,,,,,,,,,
"For BI performance purposes, the implementor can select five of these properties to be denormalized into the Cases table. This avoids query-time parsing of JSON and joins. ",,,,,,,,,,
,,,,,,,,,,
TargetProperties are a special set of properties for which we track something at the case level. See the description for the TargetProperties column..,NULL,NULL,NULL,NULL,NULL,NULL,NULL,-1,,
Column,CasePropertiesParsed.PropertyValueNumeric,Database Column named CasePropertiesParsed.PropertyValueNumeric. Case-level properties intended to be things that will be the target values of analysis.,NULL,NULL,NULL,NULL,NULL,NULL,NULL,-1
Column,CasePropertiesParsed.SortValue,Database Column named CasePropertiesParsed.SortValue. A value that allows the propertyname to be sorted. It comes from the property json:,,,,,,,,
,,,,,,,,,,
"{""Sizes"": {""value"": ""large"", ""sort_value"": 5}",NULL,NULL,NULL,NULL,NULL,NULL,NULL,-1,,
Column,ModelSimilarity.IsMutuallyExclusive,Database Column named ModelSimilarity.IsMutuallyExclusive. Mutually exclusive means the cases comprising both models do not overlap.,,,,,,,,
,,,,,,,,,,
"NULL = Hasn't been determined, 0 = No, 1 = Is Mututally exclusive.",,,,,,,,,,
,,,,,,,,,,
"If model are sliced from different partitions, the EventFacts comprising the models are mutually exclusive. If the models are mutually exclusive, they can be added.",NULL,NULL,NULL,NULL,NULL,NULL,NULL,-1,,
Column,EventPropertiesParsed.CaseID,"Database Column named EventPropertiesParsed.CaseID. CaseID will help for Azure Synapse deployment. The idea is to hash on CaseID and distrubte. That way, Cases, EventFacts, EventPropertiesParsed, and CasePropertiesParsed can be hash distributed by CaseID.",NULL,NULL,NULL,NULL,NULL,NULL,NULL,-1
Column,EventPropertiesParsed.EventDate,"Database Column named EventPropertiesParsed.EventDate. Used like a covering index, so we can filter event properties better. Don't need to do join from EventPropertiesParsed to EventFacts.",NULL,NULL,NULL,NULL,NULL,NULL,NULL,-1
Column,EventPropertiesParsed.EventPropertyCountAllocation,"Database Column named EventPropertiesParsed.EventPropertyCountAllocation. Count of properties for eventid. It's used to allocate count, avoiding a distinct count.",NULL,NULL,NULL,NULL,NULL,NULL,NULL,-1
Column,EventPropertiesParsed.PropertySource,"Database Column named EventPropertiesParsed.PropertySource. 0 = ActualProperties, 1=ExpectedProperties, 2=AggregationProperties, 3=IntendedProperties",NULL,NULL,NULL,NULL,NULL,NULL,NULL,-1
Column,ModelProperties.CaseLevel,Database Column named ModelProperties.CaseLevel. This is a property parsed out of Models.CaseFilterProperties. ,NULL,NULL,NULL,NULL,NULL,NULL,NULL,-1
Column,ModelProperties.PropertyValueNumeric,Database Column named ModelProperties.PropertyValueNumeric. This should actually be PropertyValue.,NULL,NULL,NULL,NULL,NULL,NULL,NULL,-1
Instance,Model,"Cached Markov Model--Event Set: cardiology,StartDateTime: 1900-01-01,EndDateTime: 2050-12-31--Transforms: None--Case Filters: None",NULL,NULL,NULL,NULL,NULL,NULL,NULL,7
Instance,Model,"Cached Markov Model--Event Set: cardiology,StartDateTime: 1900-01-01,EndDateTime: 2050-12-31--Transforms: None--Case Filters: None",NULL,NULL,NULL,NULL,NULL,NULL,NULL,7
Instance,Event Type,User abandons shopping cart--Code:abandoncart,NULL,NULL,NULL,NULL,NULL,Event,abandoncart,-1
Instance,Event Type,User abandons shopping cart--Code:abandonedcart,NULL,NULL,NULL,NULL,NULL,Event,abandonedcart,-1
Instance,Event Type,Place a bet before the start--Code:ante,NULL,NULL,NULL,NULL,NULL,Event,ante,-1
Instance,Event Type,Arnold event type 1--Code:arnold1,NULL,NULL,NULL,NULL,NULL,Event,arnold1,-1
Instance,Event Type,Arnold event type 2--Code:arnold2,NULL,NULL,NULL,NULL,NULL,Event,arnold2,-1
Instance,Souce Column,Natural/business key linking the lab order to a parent hospital visit or encounter.--Code:EHR.UnknownTable.ParentVisitNatKey,NULL,NULL,NULL,NULL,NULL,Database.Source.Table.Column,EHR.UnknownTable.ParentVisitNatKey,-1
Instance,Souce Column,Unique identifier for the laboratory test workflow or processing order.--Code:EHR.UnknownTable.LabWorkflowID,NULL,NULL,NULL,NULL,NULL,Database.Source.Table.Column,EHR.UnknownTable.LabWorkflowID,-1
Instance,Souce Column,"Laboratory test panel or grouped set of tests ordered (e.g., CMP, CBC, lipid panel).--Code:EHR.UnknownTable.Panel",NULL,NULL,NULL,NULL,NULL,Database.Source.Table.Column,EHR.UnknownTable.Panel,-1
Instance,Souce Column,Medical Record Number (MRN) of the patient for whom the laboratory test was ordered.--Code:EHR.UnknownTable.PatientMRN,NULL,NULL,NULL,NULL,NULL,Database.Source.Table.Column,EHR.UnknownTable.PatientMRN,-1
Instance,Souce Column,Unique hospital visit or encounter identifier associated with this lab order.--Code:EHR.UnknownTable.VisitID,NULL,NULL,NULL,NULL,NULL,Database.Source.Table.Column,EHR.UnknownTable.VisitID,-1
Instance,Souce Column,"Unique identifier for the MRI imaging workflow, study order, or radiology procedure.--Code:EHR.UnknownTable.MRIWorkflowID",NULL,NULL,NULL,NULL,NULL,Database.Source.Table.Column,EHR.UnknownTable.MRIWorkflowID,-1
Instance,Souce Column,Natural/business key linking the MRI order back to a parent visit or encounter.--Code:EHR.UnknownTable.ParentVisitNatKey,NULL,NULL,NULL,NULL,NULL,Database.Source.Table.Column,EHR.UnknownTable.ParentVisitNatKey,-1
Instance,Souce Column,Medical Record Number (MRN) of the patient receiving the MRI study.--Code:EHR.UnknownTable.PatientMRN,NULL,NULL,NULL,NULL,NULL,Database.Source.Table.Column,EHR.UnknownTable.PatientMRN,-1
Instance,Souce Column,Specific MRI study or imaging procedure code/description.--Code:EHR.UnknownTable.Study,NULL,NULL,NULL,NULL,NULL,Database.Source.Table.Column,EHR.UnknownTable.Study,-1
Instance,Souce Column,Unique hospital visit or encounter identifier linked to this MRI imaging order.--Code:EHR.UnknownTable.VisitID,NULL,NULL,NULL,NULL,NULL,Database.Source.Table.Column,EHR.UnknownTable.VisitID,-1
Instance,Souce Column,Event of a guest service process.--Code:Main.Tickets.Event,NULL,NULL,NULL,NULL,NULL,Database.Source.Table.Column,Main.Tickets.Event,-1
Table,dbo.Models,"This is a database table that stores data named dbo.Models.The primary table of the Markov Model ensemble of TimeSolution. This table holds the parameters of the markov models created from the events in dbo.EventFacts. The Markov model segments are in the ModelEvents table. Columns of this table include: [AccessBitmap,ByCase,CaseFilterProperties,CreateDate,CreatedBy_AccessBitmap,CreatedBy_UserID,CreationDuration,Description,DistinctCases,EndDateTime,enumerate_multiple_events,EventFactRows,EventFilterProperties,EventSetKey,IRI,LastUpdate,MetricID,modelid,ModelType,Order,ParamHash,StartDateTime,transformskey]",NULL,NULL,NULL,NULL,NULL,NULL,NULL,-1
Table,dbo.ModelSequences,"This is a database table that stores data named dbo.ModelSequences.Stores statistics on sequences of events that actually have occurred, in the EventsFact table. For example, arrive->greeted->seated. It's good to know how often a sequence happens, along with other information. Columns of this table include: [Cases,CreateDate,HopAvg,HopMax,HopMin,HopStDev,lastEvent,length,ModelID,nextEvent,Prob,Rows,Seq,SeqAvg,SeqKey,SeqMax,SeqMin,SeqStDev,SeqSum,TermRows,TotalRows]",NULL,NULL,NULL,NULL,NULL,NULL,NULL,-1
Table,dbo.ModelSimilarity,"This is a database table that stores data named dbo.ModelSimilarity.Scores the difference between two markov models. This is one of the prime use cases for time molecules. This is done using the InsertModelSimilarities stored procedure. Columns of this table include: [CombinedUniqueSegments,CosineSimilarity,IsMutuallyExclusive,Model1Segments,Model2Segments,ModelID1,ModelID2,PercentSameSegments,SameSegments_ttest]",NULL,NULL,NULL,NULL,NULL,NULL,NULL,-1
SQL_STORED_PROCEDURE,[dbo].[InsertModelSimilarities],"Database Stored procedure that executes a process, named, [dbo].[InsertModelSimilarities]: Compares two Markov models based on their event transition segments, calculating Jaccard-style overlap, cosine similarity of transition probabilities, and t-test for average transition times. Stores the similarity metrics in the ModelSimilarity table. Optionally outputs segment-level comparison details.","Use when you want to compute and store similarities between models so related models can be compared, grouped, or recommended later.",[,,,,,,
,"  {""name"": ""@ModelID1"", ""type"": ""INT"", ""default value"": ""NULL"", ""description"": ""ID of the first model to compare. Must exist in ModelEvents.""},",,,,,,,,,
,"  {""name"": ""@ModelID2"", ""type"": ""INT"", ""default value"": ""NULL"", ""description"": ""ID of the second model to compare. Must exist in ModelEvents.""},",,,,,,,,,
,"  {""name"": ""@DisplaySegments"", ""type"": ""BIT"", ""default value"": ""1"", ""description"": ""If set to 1, displays segment-by-segment comparison between the models.""}",,,,,,,,,
,],[],[,,,,,,,
,"  {""name"": ""dbo.ModelEvents"", ""type"": ""Table"", ""description"": ""Stores segments of each model including transition pairs, statistics, and probabilities.""},",,,,,,,,,
,"  {""name"": ""dbo.ModelSimilarity"", ""type"": ""Table"", ""description"": ""Holds precomputed similarity metrics between pairs of models for analysis or recommendation.""}",,,,,,,,,
,],NULL,NULL,NULL,-1,,,,,
SQL_SCALAR_FUNCTION,[dbo].[PropertySource],"Database function that returns a value, named, [dbo].[PropertySource]: Translates a numeric PropertySourceKey into its corresponding property category name for use in property metadata.","Use when you need to standardize or decode where a property came from, such as distinguishing raw source-derived properties from transformed or derived ones.",[,,,,,,
"    { ""name"": ""@PropertySourceKey"", ""type"": ""TINYINT"", ""default"": null, ""description"": ""0 = InputProperties, 1 = OutputProperties, 2 = AggregationProperties."" }",,,,,,,,,,
  ],[,,,,,,,,,
"    { ""name"": ""Return Value"", ""type"": ""NVARCHAR(30)"", ""description"": ""The matching property source name, or NULL if the key is unrecognized."" }",,,,,,,,,,
  ],[],NULL,NULL,NULL,-1,,,,,
SQL_STORED_PROCEDURE,[dbo].[utility_LogProcError],"Database Stored procedure that executes a process, named, [dbo].[utility_LogProcError]: Inserts a row into dbo.ProcErrorLog for procedure events, warnings, or errors.","Use when procedures need a common, reusable way to write rows to dbo.ProcErrorLog instead of repeating manual INSERT statements.",[,,,,,,
"    { ""name"": ""@ProcedureName"", ""type"": ""NVARCHAR(128)"", ""default"": ""NULL"", ""description"": ""Name of the calling procedure. If NULL, caller may pass OBJECT_NAME(@@PROCID)."" },",,,,,,,,,,
"    { ""name"": ""@EventName"", ""type"": ""NVARCHAR(128)"", ""default"": ""NULL"", ""description"": ""Short event label such as ERROR, BatchDeleted, ModelDeleted, or ImportStarted."" },",,,,,,,,,,
"    { ""name"": ""@PropertyName"", ""type"": ""NVARCHAR(128)"", ""default"": ""NULL"", ""description"": ""Optional contextual property such as BatchID, CaseID, ModelID, or parameter name."" },",,,,,,,,,,
